<?xml version="1.0" standalone="no" ?>
<manifest identifier="__ngGnH57sNCYHfic7Vodn8Yaj5qldVFggM-hsoA" version="1.3"
  xmlns="http://www.imsglobal.org/xsd/imscp_v1p1"
  xmlns:xsi="http://www.w3.org/2001/XMLSchema-instance"
  xmlns:adlcp="http://www.adlnet.org/xsd/adlcp_v1p3"
  xmlns:adlseq="http://www.adlnet.org/xsd/adlseq_v1p3"
  xmlns:imsss="http://www.imsglobal.org/xsd/imsss"
  xsi:schemaLocation="http://www.imsglobal.org/xsd/imscp_v1p1 imscp_v1p1.xsd
                      http://www.adlnet.org/xsd/adlcp_v1p3 adlcp_v1p3.xsd
                      http://www.adlnet.org/xsd/adlseq_v1p3 adlseq_v1p3.xsd
                      http://www.imsglobal.org/xsd/imsss imsss_v1p0.xsd">
  <metadata>
    <schema>ADL SCORM</schema>
    <schemaversion>2004 4th Edition</schemaversion>
    <adlcp:location>metadata.xml</adlcp:location>   
  </metadata>
  <organizations default="B0">
    <organization identifier="B0" adlseq:objectivesGlobalToSystem="false">
      <title>FR- WEBSTORE #1 - Bien démarrer !</title>
      <item identifier="i1" identifierref="r1" isvisible="true">
        <title>FR- WEBSTORE #1 - Bien démarrer !</title>
        <adlcp:dataFromLMS>eyJjcHYiOiJnZ00taHNvQSIsInJsZCI6ZmFsc2V9</adlcp:dataFromLMS>
        <imsss:sequencing>
          <imsss:deliveryControls tracked="true" completionSetByContent="true" objectiveSetByContent="true"/>
        </imsss:sequencing>
      </item>
      <metadata>
        <adlcp:location>metadata.xml</adlcp:location>
      </metadata>
      <imsss:sequencing>
        <imsss:controlMode choice="true" flow="true"/>
      </imsss:sequencing>
    </organization>
  </organizations>
  <resources>
    <resource identifier="r1" type="webcontent" adlcp:scormType="sco" href="scormdriver/indexAPI.html">
      <!-- SCORMDRIVER STUFF -->
      <file href="scormdriver/indexAPI.html" />
      <file href="scormdriver/preloadIntegrity.js" />
      <file href="scormdriver/driverOptions.js" />
      <file href="scormdriver/AICCComm.html" />
      <file href="scormdriver/auto-scripts/AutoBookmark.js" />
      <file href="scormdriver/auto-scripts/AutoCompleteSCO.js" />
      <file href="scormdriver/auto-scripts/CourseExit.js" />
      <file href="scormdriver/blank.html" />
      <file href="scormdriver/goodbye.html" />
      <file href="scormdriver/scormdriver.js" />
      <file href="scormdriver/browsersniff.js" />

      <!-- RUNTIME COMMON STUFF -->
      <file href="scormcontent/index.html" />

      
        <file href="scormcontent/lib/fonts/icomoon.ttf"/>
        <file href="scormcontent/lib/fonts/icomoon.woff"/>

        <file href="scormcontent/lib/icomoon.css"/>
        <file href="scormcontent/lib/player-0.0.11.min.js"/>
        <file href="scormcontent/lib/lzwcompress.js"/>
      

      <!-- FRONTEND BUNDLE ASSETS -->
      <file href="scormcontent/lib/rise/5d5a7671.js" />
<file href="scormcontent/lib/rise/fa74d7f1.css" />
<file href="scormcontent/lib/rise/ede5dd04.js" />
<file href="scormcontent/lib/rise/1cf4b6e0.css" />
<file href="scormcontent/lib/rise/a41cfcfc.js" />
<file href="scormcontent/lib/rise/254e83dc.js" />
<file href="scormcontent/lib/rise/c82cca6a.js" />
<file href="scormcontent/lib/rise/40b4cf18.js" />
<file href="scormcontent/lib/rise/b2cebec4.js" />
<file href="scormcontent/lib/rise/70fd6e03.js" />
<file href="scormcontent/lib/rise/48ed4c70.js" />
<file href="scormcontent/lib/rise/0bcec83e.js" />
<file href="scormcontent/lib/rise/bd8404c0.js" />
<file href="scormcontent/lib/mondrian/entry.js" />
<file href="scormcontent/lib/mondrian/ab103845.js" />
<file href="scormcontent/lib/mondrian/1a68f054.js" />
<file href="scormcontent/lib/mondrian/03ab2a8e.js" />
<file href="scormcontent/lib/mondrian/daeabcf0.js" />
<file href="scormcontent/lib/mondrian/45d26a13.js" />
<file href="scormcontent/lib/mondrian/09e37aee.js" />
<file href="scormcontent/lib/mondrian/196251cf.js" />
<file href="scormcontent/lib/sandbox/sandbox.html" />
<file href="scormcontent/lib/sandbox/b8fc6988.js" />
<file href="scormcontent/lib/sandbox/4adfab46.css" />


      <!-- RUNTIME CONTENT STUFF -->
      <file href="scormcontent/lib/fonts/Lato2-Regular.woff" />
<file href="scormcontent/lib/fonts/Lato2-Light.woff" />
<file href="scormcontent/lib/fonts/Lato2-Italic.woff" />
<file href="scormcontent/lib/fonts/Lato2-Bold.woff" />
<file href="scormcontent/lib/fonts/Lato2-Black.woff" />
<file href="scormcontent/lib/fonts/Merriweather-Black.woff" />
<file href="scormcontent/lib/fonts/Merriweather-Italic.woff" />
<file href="scormcontent/lib/fonts/Merriweather-Bold.woff" />
<file href="scormcontent/lib/fonts/Merriweather-Regular.woff" />
<file href="scormcontent/lib/fonts/Merriweather-Light.woff" />
<file href="scormcontent/assets/jGFlpDKW8wepF03E.jpg" />
<file href="scormcontent/assets/test%20fond.png" />
<file href="scormcontent/assets/look.png" />
<file href="scormcontent/assets/passer%20commande.png" />
<file href="scormcontent/assets/suivre%20etat%20commandes.png" />
<file href="scormcontent/assets/demandess.png" />
<file href="scormcontent/assets/pL3pmy/test%20fond.png" />
<file href="scormcontent/assets/connexionn.jpg" />
<file href="scormcontent/assets/connexion%20webstore.jpg" />
<file href="scormcontent/assets/4fHQzf/test%20fond.png" />
<file href="scormcontent/assets/test%20page%20d%27accueil.jpg" />
<file href="scormcontent/assets/langue.png" />
<file href="scormcontent/assets/Mes%20commandes.jpg" />
<file href="scormcontent/assets/menu%20famille.jpg" />
<file href="scormcontent/assets/panier.jpg" />
<file href="scormcontent/assets/d%C3%A9connexion.jpg" />
<file href="scormcontent/assets/mon%20magasin.jpg" />
<file href="scormcontent/assets/slider.jpg" />
<file href="scormcontent/assets/barre%20de%20recherche%20filtre.jpg" />
<file href="scormcontent/assets/BOPgpCUEiyJXUKw8.png" />

      <file href="scormcontent/locales/en.js" />

    </resource>
  </resources>
</manifest>
