<?xml version="1.0" standalone="no" ?>
<manifest identifier="gi0w43r5S9yP-ARGUO297EvfCrX0UOeCRE0n4o5d" version="1.3"
  xmlns="http://www.imsglobal.org/xsd/imscp_v1p1"
  xmlns:xsi="http://www.w3.org/2001/XMLSchema-instance"
  xmlns:adlcp="http://www.adlnet.org/xsd/adlcp_v1p3"
  xmlns:adlseq="http://www.adlnet.org/xsd/adlseq_v1p3"
  xmlns:imsss="http://www.imsglobal.org/xsd/imsss"
  xsi:schemaLocation="http://www.imsglobal.org/xsd/imscp_v1p1 imscp_v1p1.xsd
                      http://www.adlnet.org/xsd/adlcp_v1p3 adlcp_v1p3.xsd
                      http://www.adlnet.org/xsd/adlseq_v1p3 adlseq_v1p3.xsd
                      http://www.imsglobal.org/xsd/imsss imsss_v1p0.xsd">
  <metadata>
    <schema>ADL SCORM</schema>
    <schemaversion>2004 3rd Edition</schemaversion>
    <adlcp:location>metadata.xml</adlcp:location>
  </metadata>
  <organizations default="B0">
    <organization identifier="B0" adlseq:objectivesGlobalToSystem="false">
      <title>New Manager Training</title>
      <item identifier="i1" identifierref="r1" isvisible="true">
        <title>New Manager Training</title>
        <adlcp:dataFromLMS>eyJjcHYiOiJSRTBuNG81ZCIsInJsZCI6ZmFsc2V9</adlcp:dataFromLMS>
        <imsss:sequencing>
          <imsss:deliveryControls tracked="true" completionSetByContent="true" objectiveSetByContent="true"/>
        </imsss:sequencing>
      </item>
      <metadata>
        <adlcp:location>metadata.xml</adlcp:location>
      </metadata>
      <imsss:sequencing>
        <imsss:controlMode choice="true" flow="true"/>
      </imsss:sequencing>
    </organization>
  </organizations>
  <resources>
    <resource identifier="r1" type="webcontent" adlcp:scormType="sco" href="scormdriver/indexAPI.html">
      <!-- SCORMDRIVER STUFF -->
      <file href="scormdriver/indexAPI.html" />
      <file href="scormdriver/preloadIntegrity.js" />
      <file href="scormdriver/driverOptions.js" />
      <file href="scormdriver/AICCComm.html" />
      <file href="scormdriver/auto-scripts/AutoBookmark.js" />
      <file href="scormdriver/auto-scripts/AutoCompleteSCO.js" />
      <file href="scormdriver/auto-scripts/CourseExit.js" />
      <file href="scormdriver/blank.html" />
      <file href="scormdriver/goodbye.html" />
      <file href="scormdriver/scormdriver.js" />
      <file href="scormdriver/browsersniff.js" />

      <!-- RUNTIME COMMON STUFF -->
      <file href="scormcontent/index.html" />

      
        <file href="scormcontent/lib/fonts/icomoon.ttf"/>
        <file href="scormcontent/lib/fonts/icomoon.woff"/>

        <file href="scormcontent/lib/icomoon.css"/>
        <file href="scormcontent/lib/player-0.0.11.min.js"/>
        <file href="scormcontent/lib/lzwcompress.js"/>
      

      <!-- FRONTEND BUNDLE ASSETS -->
      <file href="scormcontent/lib/rise/6b7684e3.js" />
<file href="scormcontent/lib/rise/b7e6275d.css" />
<file href="scormcontent/lib/rise/6c3dba4a.js" />
<file href="scormcontent/lib/rise/391be162.css" />
<file href="scormcontent/lib/rise/f033e23f.js" />
<file href="scormcontent/lib/rise/5ce3f37c.js" />
<file href="scormcontent/lib/rise/e8c73cc3.js" />
<file href="scormcontent/lib/rise/dbd76bf1.js" />
<file href="scormcontent/lib/rise/3c4d17f3.js" />
<file href="scormcontent/lib/mondrian/entry.js" />
<file href="scormcontent/lib/mondrian/cb77b9e0.js" />
<file href="scormcontent/lib/mondrian/5ac402cf.js" />
<file href="scormcontent/lib/mondrian/215fe725.js" />
<file href="scormcontent/lib/mondrian/c16e7dd3.js" />
<file href="scormcontent/lib/mondrian/5ebb90af.js" />
<file href="scormcontent/lib/mondrian/825dd797.js" />
<file href="scormcontent/lib/mondrian/beccd965.js" />
<file href="scormcontent/lib/mondrian/56ae9b9c.js" />


      <!-- RUNTIME CONTENT STUFF -->
      <file href="scormcontent/lib/fonts/Lato-Black.woff" />
<file href="scormcontent/lib/fonts/Lato-Italic.woff" />
<file href="scormcontent/lib/fonts/Lato-Bold.woff" />
<file href="scormcontent/lib/fonts/Lato-Regular.woff" />
<file href="scormcontent/lib/fonts/Lato-Light.woff" />
<file href="scormcontent/lib/fonts/Merriweather-Black.woff" />
<file href="scormcontent/lib/fonts/Merriweather-Italic.woff" />
<file href="scormcontent/lib/fonts/Merriweather-Bold.woff" />
<file href="scormcontent/lib/fonts/Merriweather-Regular.woff" />
<file href="scormcontent/lib/fonts/Merriweather-Light.woff" />
<file href="scormcontent/assets/small.png" />
<file href="scormcontent/assets/ri4xqT1RTWcNLa7F.jpg" />
<file href="scormcontent/assets/stock-image.png" />
<file href="scormcontent/assets/X-_noprocess_8636603.jpg" />
<file href="scormcontent/assets/stock-image.jpg" />
<file href="scormcontent/assets/13hsx9/stock-image.jpg" />
<file href="scormcontent/assets/57iBKb/quote_background.jpg" />
<file href="scormcontent/assets/pztwOP/stock-image.jpg" />
<file href="scormcontent/assets/wkyDIi/mountains.jpg" />
<file href="scormcontent/assets/L_yHhK/stock-image.jpg" />
<file href="scormcontent/assets/iYQFXU/stock-image.jpg" />
<file href="scormcontent/assets/bDR81P/stock-image.jpg" />
<file href="scormcontent/assets/RlJ6aN/stock-image.jpg" />
<file href="scormcontent/assets/JUdVok/stock-image.jpg" />
<file href="scormcontent/assets/X-_noprocess_teamphoto.jpg" />
<file href="scormcontent/assets/X-_noprocess_disagreements.jpg" />
<file href="scormcontent/assets/X-_noprocess_meeting.jpg" />
<file href="scormcontent/assets/X-_noprocess_employee.jpg" />
<file href="scormcontent/assets/eh0HZ_I5kNhWgRF7-stock-image.jpg" />
<file href="scormcontent/assets/67f7trmlkpH-zyTK-stock-image.jpg" />
<file href="scormcontent/assets/X-_noprocess_7491556.jpg" />
<file href="scormcontent/assets/agency.jpg" />
<file href="scormcontent/assets/SWQYX0/stock-image.jpg" />
<file href="scormcontent/assets/X-_noprocess_coaching.jpg" />
<file href="scormcontent/assets/X-_noprocess_newmanagercoachingquiz.jpg" />
<file href="scormcontent/assets/kuO0nAooM3-Asy_F_107_full.png" />
<file href="scormcontent/assets/l7QLybhUIC0wTWOT_78_full.png" />
<file href="scormcontent/assets/mZF2cjSr-3YsU8Q__141_full.png" />
<file href="scormcontent/assets/p3qQojsBv-wg62Cg_123_full.png" />
<file href="scormcontent/assets/9EaElT33ryWbyVqJ_77_full.png" />
<file href="scormcontent/assets/0yc8-hHdgcerDNjb_143_full.png" />
<file href="scormcontent/assets/RfvI7kVjAxSFl2Wu_95_full.png" />
<file href="scormcontent/assets/zfhB-aeR-1FEMEz0_87_full.png" />
<file href="scormcontent/assets/P6LxkwQUwDzLkbFU_120_full.png" />
<file href="scormcontent/assets/1hzwLpP7wI0XUY_0_81_full.png" />
<file href="scormcontent/assets/X5CuN7N9fEPdcnD3_79_full.png" />
<file href="scormcontent/assets/4G1RWlft1mZKUZRB_140_full.png" />

      <file href="scormcontent/locales/und.js" />

    </resource>
  </resources>
</manifest>
